{
  "schemaVersion": "0.3.0",
  "runId": "019deafb-a0a1-79d0-a895-c8526aa0d8f2",
  "analyzedAt": "2026-05-02T23:19:07.000000+00:00",
  "provider": {
    "name": "twelvelabs",
    "model": "pegasus1.5",
    "rawResponseRef": "cache/019deafb-a0a1-79d0-a895-c8526aa0d8f2/raw-output.json"
  },
  "clips": [
    {
      "id": "IMG_0774",
      "sourcePath": "assets/2026-05-02/IMG_0774.MOV",
      "originalFilename": "IMG_0774.MOV",
      "durationSec": 24.3,
      "capturedAt": "2026-05-02T18:14:25-04:00",
      "location": {
        "latitude": 40.7128,
        "longitude": -74.006,
        "raw": "+40.7128-074.0060+000.000/",
        "source": "metadata",
        "altitude": 0
      },
      "media": {
        "durationSec": 24.3,
        "width": 3840,
        "height": 2160,
        "fps": 29.97,
        "hasAudio": true,
        "orientation": "horizontal",
        "captureMetadata": {
          "capturedAt": "2026-05-02T18:14:25-04:00",
          "location": {
            "latitude": 40.7128,
            "longitude": -74.006,
            "raw": "+40.7128-074.0060+000.000/",
            "source": "metadata",
            "altitude": 0
          }
        }
      },
      "twelveLabs": {
        "assetId": "69f686494914aa1f3cc3b099",
        "taskId": "69f6864abfb69dda6bfb851f"
      },
      "summary": "A person walks through a lively food market. Close-ups show grilled food and people moving through the space.",
      "moments": [
        {
          "momentId": "moment-001",
          "startSec": 0,
          "endSec": 3.2,
          "description": "Wide view of a busy market walkway with food stalls and people passing by.",
          "subjects": ["market walkway", "food stalls", "people"],
          "actions": ["walking", "people passing"],
          "visibleText": [],
          "spokenText": "",
          "audio": ["crowd noise", "ambient chatter"],
          "quality": "good",
          "issues": ["slight handheld motion"],
          "whyUseful": "Clear place-setting moment with movement and atmosphere."
        },
        {
          "momentId": "moment-002",
          "startSec": 3.2,
          "endSec": 6.8,
          "description": "Close view of food cooking with steam rising from the grill.",
          "subjects": ["grill", "food", "steam"],
          "actions": ["cooking", "steam rising"],
          "visibleText": [],
          "spokenText": "",
          "audio": ["sizzling", "crowd noise"],
          "quality": "great",
          "issues": [],
          "whyUseful": "Strong sensory food moment with clear subject and visible motion."
        }
      ]
    }
  ]
}
